{
  "schemaVersion": "2.0",
  "instanceName": "MenuForge Demo Restaurant",
  "updatedAt": "2026-06-15T17:00:00Z",
  "categories": [
    {
      "id": "antipasti",
      "slug": "antipasti",
      "title": "Antipasti",
      "subtitle": "Piccoli piatti da condividere",
      "note": "Serviti dalle 18:30",
      "categoryImageUrl": "",
      "visible": true,
      "position": 0,
      "items": [
        {
          "id": "bruschetta-casa",
          "title": "Bruschetta della casa",
          "price": "6,00",
          "description": "Pane tostato, pomodoro marinato, basilico e olio EVO.",
          "imageUrl": "",
          "highlight": true,
          "available": true,
          "position": 0,
          "calories": "320 kcal",
          "origin": "Italia",
          "format": "Porzione",
          "specialText1": "Vegetariano",
          "specialText2": "Pane artigianale",
          "specialText3": "",
          "ingredients": ["Pane", "Pomodoro", "Basilico", "Olio EVO"],
          "tag1": ["vegetariano"],
          "tag2": ["consigliato"],
          "tag3": ["estate"],
          "badges": [
            { "id": "chef", "label": "Scelto dallo chef", "style": "accent" }
          ],
          "allergens": [
            { "id": 1, "code": "GLUTEN", "nameIt": "Cereali contenenti glutine" }
          ],
          "customAttributes": [
            { "key": "tempo", "label": "Tempo", "value": "5 min" }
          ]
        }
      ]
    },
    {
      "id": "primi",
      "slug": "primi",
      "title": "Primi",
      "subtitle": "Pasta fresca e ricette del giorno",
      "note": "",
      "categoryImageUrl": "",
      "visible": true,
      "position": 1,
      "items": [
        {
          "id": "tagliatelle-ragu",
          "title": "Tagliatelle al ragu",
          "price": "13,00",
          "description": "Pasta fresca con ragu cotto lentamente.",
          "imageUrl": "",
          "highlight": false,
          "available": true,
          "position": 0,
          "calories": "",
          "origin": "Emilia-Romagna",
          "format": "Piatto",
          "specialText1": "",
          "specialText2": "",
          "specialText3": "",
          "ingredients": ["Tagliatelle", "Manzo", "Pomodoro"],
          "tag1": ["pasta"],
          "tag2": ["carne"],
          "tag3": [],
          "badges": [],
          "allergens": [
            { "id": 1, "code": "GLUTEN", "nameIt": "Cereali contenenti glutine" },
            { "id": 3, "code": "EGGS", "nameIt": "Uova e prodotti a base di uova" }
          ],
          "customAttributes": []
        }
      ]
    }
  ],
  "badges": [
    { "id": "chef", "label": "Scelto dallo chef", "style": "accent" },
    { "id": "new", "label": "Novita'", "style": "fresh" }
  ],
  "allergens": [
    { "id": 1, "code": "GLUTEN", "nameIt": "Cereali contenenti glutine" },
    { "id": 2, "code": "CRUSTACEANS", "nameIt": "Crostacei e prodotti a base di crostacei" },
    { "id": 3, "code": "EGGS", "nameIt": "Uova e prodotti a base di uova" },
    { "id": 4, "code": "FISH", "nameIt": "Pesce e prodotti a base di pesce" },
    { "id": 5, "code": "PEANUTS", "nameIt": "Arachidi e prodotti a base di arachidi" },
    { "id": 6, "code": "SOYBEANS", "nameIt": "Soia e prodotti a base di soia" },
    { "id": 7, "code": "MILK", "nameIt": "Latte e prodotti a base di latte" },
    { "id": 8, "code": "NUTS", "nameIt": "Frutta a guscio" },
    { "id": 9, "code": "CELERY", "nameIt": "Sedano e prodotti a base di sedano" },
    { "id": 10, "code": "MUSTARD", "nameIt": "Senape e prodotti a base di senape" },
    { "id": 11, "code": "SESAME", "nameIt": "Semi di sesamo" },
    { "id": 12, "code": "SULPHITES", "nameIt": "Anidride solforosa e solfiti" },
    { "id": 13, "code": "LUPIN", "nameIt": "Lupini e prodotti a base di lupini" },
    { "id": 14, "code": "MOLLUSCS", "nameIt": "Molluschi e prodotti a base di molluschi" }
  ]
}

